{"schema_version":1,"campaign_id":"standalone","run_id":"chapman-mkpp","block":0,"order_position":0,"solver":{"id":"mkpp","version":"0.1.0","revision":"workspace","backend":"Kokkos::DefaultExecutionSpace","method":"ros3"},"manifest":{"id":"chapman","version":"1.0.0","sha256":"0000000000000000000000000000000000000000000000000000000000000000"},"scenario":{"id":"chapman-measurement-v1","version":"1.0.0","sha256":"0000000000000000000000000000000000000000000000000000000000000000"},"configuration":{"id":"mkpp-ros3","sha256":"0000000000000000000000000000000000000000000000000000000000000000","frozen":true,"controls":{"dt":60}},"build":{"binary_sha256":"unavailable-at-runtime","asset_sha256":[],"compiler":"gcc","flags":[],"precision":"float64"},"resources":{"hardware_id":"runtime-host","physical_cores":1,"threads":1,"affinity":"external-policy","numa_policy":"external-policy"},"timing":{"boundary":"steady_state_solve","elapsed_ms":0.73045000000000004,"cell_steps":10,"clock":"std::chrono::steady_clock","synchronized":true,"synchronization":"Kokkos::fence","lifecycle_ms":{}},"state":{"checkpoints":[{"time_seconds":600,"values":{"O":1209.5913769362605,"O2":5.0999999883346504e+18,"O3":808610250228.89685,"M":2.46e+19}}]},"work":{"internal_steps":{"available":false,"reason":"generated MKPP kernel does not expose this counter"}},"status":"success","diagnostics":[]}
