{"schema_version":1,"campaign_id":"ts1-smoke","run_id":"micm-ts1-0","block":0,"order_position":0,"solver":{"id":"micm","version":"3.13.0","revision":"97ac9e5d8aadd345c242722ee8274d71dfe0f73e","backend":"cpu","method":"three-stage-rosenbrock"},"manifest":{"id":"ts1","version":"1.0.0","sha256":"0000000000000000000000000000000000000000000000000000000000000000"},"scenario":{"id":"ts1-measurement-v1","version":"1.0.0","sha256":"0000000000000000000000000000000000000000000000000000000000000000"},"configuration":{"id":"micm-ts1-ros3","sha256":"0000000000000000000000000000000000000000000000000000000000000000","frozen":true,"controls":{"schedule_segments":2,"schedule_seconds":600}},"build":{"binary_sha256":"0000000000000000000000000000000000000000000000000000000000000000","asset_sha256":["0000000000000000000000000000000000000000000000000000000000000000"],"compiler":"c++20","flags":[],"precision":"binary64"},"resources":{"hardware_id":"local","physical_cores":1,"threads":1,"affinity":"unspecified","numa_policy":"unspecified"},"timing":{"boundary":"steady_state_solve","elapsed_ms":773.17250000000001,"cell_steps":6,"clock":"std::chrono::steady_clock","synchronized":true,"synchronization":"synchronous MICM CPU Solve plus atomic fence","lifecycle_ms":{}},"state":{"checkpoints":[{"time_seconds":600,"values":{"ACBZO2":3.437699619901411e-17,"ALKNIT":1.0319989757169682e-261,"ALKO2":1.8423714564177836e-259,"ALKOOH":1.355934354003274e-259,"BCARY":0,"BCARYO2VBS":0,"BENZENE":0,"BENZO2":2.5718767428387553e-307,"BENZO2VBS":0,"BENZOOH":1.8944319789860567e-307,"BEPOMUC":1.7506243767974124e-10,"BIGALD":3.8646980220504318e-12,"BIGALD1":6.6423986321184054e-10,"BIGALD2":3.2981512695239818e-10,"BIGALD3":3.0363495083505903e-10,"BIGALD4":1.0588900354846967e-09,"BIGALK":0,"BIGENE":0,"BR":3.1968774768764319e-10,"BRCL":9.6006307655877253e-11,"BRO":2.7411676686502091e-10,"BRONO2":3.0580652410547749e-14,"BZALD":8.3328539961296552e-310,"BZOO":1.471913315535698e-307,"BZOOH":1.0842042345188051e-307,"C2H2":0,"C2H4":0,"C2H5O2":8.6605670129124932e-269,"C2H5OH":3.1289024670384814e-280,"C2H5OOH":6.3739426982286136e-269,"C2H6":0,"C3H6":0,"C3H7O2":4.0530107324735037e-261,"C3H7OOH":2.9829774875914616e-261,"C3H8":0,"C6H5O2":5.4651941324927489e-10,"C6H5OOH":4.003695766782425e-10,"CCL4":4.352861038946486e-41,"CF2CLBR":1.5427069863204509e-22,"CF3BR":4.0335954134319839e-16,"CFC11":4.5070607164490789e-34,"CFC113":8.5029336042715247e-35,"CFC114":3.2027772773320521e-24,"CFC115":7.0256738305384886e-16,"CFC12":3.8193000821644847e-23,"CH2BR2":0,"CH2O":3.6813428614955661e-15,"CH3BR":1.1419528693734269e-294,"CH3CCL3":1.5531034364275519e-94,"CH3CHO":8.7550108900527671e-262,"CH3CL":9.1972335379764398e-313,"CH3CN":5.5665938568646775e-213,"CH3CO3":2.0093090991933902e-15,"CH3COCH3":2.9527463137888851e-260,"CH3COCHO":2.4677876032691162e-16,"CH3COOH":4.0715192172826681e-15,"CH3COOOH":8.3949542774942911e-15,"CH3O2":1.5529393609163048e-14,"CH3OH":1.0903741196701682e-24,"CH3OOH":7.4007622214241641e-15,"CH4":1.4821969375237396e-323,"CHBR3":0,"CL":4.0791508217232335e-10,"CL2":9.5922898237450682e-11,"CL2O2":2.4227576705787471e-13,"CLO":4.8525241880436198e-09,"CLONO2":5.2012808845658705e-11,"CO":6.1520441914770802e-05,"CO2":0.015613593643679593,"COF2":1.0188362895297692e-10,"COFCL":8.688209246816013e-31,"CRESOL":0,"DICARBO2":1.1617668116942247e-15,"DMS":0,"E90":9.9992260299529698e-16,"ENEO2":1.4821969375237396e-323,"EO":2.0527269723842837e-18,"EO2":0,"EOOH":2.8589174686776697e-08,"F":8.2386115046580301e-15,"GLYALD":6.6444604510518014e-18,"GLYOXAL":3.2220254376668966e-16,"H":2.2238787181733035e-06,"H2":0.6196027521601597,"H2402":3.383504444974422e-26,"H2O":0.1261997507803318,"H2O2":0.00024868727286039746,"H2SO4":8.1296700017505524e-08,"HBR":3.0623075574886711e-11,"HCFC141B":7.0877654712217418e-80,"HCFC142B":1.9390464508729135e-53,"HCFC22":6.8421517720193171e-59,"HCL":8.9681750451550063e-08,"HCN":8.5029255506943482e-99,"HCOOH":3.8348961978657927e-16,"HF":8.0331839780566741e-08,"HNO3":1.2911380317806325e-05,"HO2":3.6574411613671193e-05,"HO2NO2":4.9003115173195089e-08,"HOBR":5.8316819115776765e-11,"HOCH2OO":2.7228982792620507e-17,"HOCL":2.3544737770840989e-08,"HONITR":0,"HPALD":0,"HYAC":3.9152672462962601e-271,"HYDRALD":0,"IEPOX":0,"ISOP":0,"ISOPAO2":0,"ISOPBO2":0,"ISOPNITA":0,"ISOPNITB":0,"ISOPNO3":0,"ISOPNOOH":0,"ISOPO2VBS":0,"ISOPOOH":0,"IVOC":0,"IVOCO2VBS":0,"MACR":0,"MACRO2":0,"MACROOH":0,"MALO2":1.6413276533607703e-15,"MCO3":0,"MDIALO2":1.0695476948256888e-15,"MEK":6.2773753176228532e-261,"MEKO2":7.1233523899596794e-261,"MEKOOH":4.194069648187411e-261,"MPAN":0,"MTERP":0,"MTERPO2VBS":0,"MVK":0,"N":2.7185739799432518e-18,"N2":33.100772051931841,"N2O":5.4214158358404283e-17,"N2O5":1.0318156475424385e-06,"NC4CH2OH":0,"NC4CHO":0,"NH3":0,"NH4":9.999619607235109e-16,"NH_5":9.9861496005439587e-16,"NH_50":9.9986140960452823e-16,"NO":4.4147910185281112e-07,"NO2":1.9814222993706621e-07,"NO3":6.9935351133874841e-08,"NOA":0,"NTERPO2":4.9406564584124654e-324,"NTERPOOH":0,"O":0.00014256354346338384,"O1D":4.6587719403852141e-10,"O2":0.18161578907802436,"O3":0.0067207272433020228,"OCLO":7.0234214043453635e-11,"OCS":4.6004568591184709e-260,"OH":5.6108105049464237e-05,"ONITR":9.2749880628910861e-09,"PAN":1.6603752182474018e-15,"PBZNIT":1.7131334029841532e-10,"PHENO":1.1865337795173837e-12,"PHENO2":1.1419803466005659e-307,"PHENOL":0,"PHENOOH":8.4117720415551409e-308,"PO2":0,"POOH":0,"RO2":5.1863648442745379e-261,"ROOH":3.7203207156714589e-261,"S":1.8563388228341299e-81,"SF6":1.0000000000000001e-15,"SO":2.0718666710541427e-54,"SO2":5.1450780073190069e-29,"SO3":7.0894460998714349e-21,"SOAG0":1.8801530779069762e-09,"SOAG1":7.8367394590622624e-10,"SOAG2":2.3626995095780335e-09,"SOAG3":5.9966394476933737e-09,"SOAG4":2.4492471382688016e-08,"ST80_25":9.997222385828593e-16,"SVOC":0,"TEPOMUC":7.2947461788702158e-10,"TERP2O2":0,"TERP2OOH":0,"TERPNIT":0,"TERPO2":0,"TERPOOH":0,"TERPROD1":0,"TERPROD2":0,"TOLO2":8.9445423184612719e-307,"TOLOOH":6.5885066431231508e-307,"TOLUENE":0,"TOLUO2VBS":0,"XO2":0,"XOOH":0,"XYLENES":0,"XYLENO2":4.7399766543193993e-307,"XYLENOOH":3.4914438954328149e-307,"XYLEO2VBS":0,"XYLOL":0,"XYLOLO2":4.6526212280419215e-308,"XYLOLOOH":3.4270983106224959e-308,"sink":6.1499999999999884e-33,"soa1_a1":1.0000000000000001e-15,"soa1_a2":1.0000000000000001e-15,"soa2_a1":1.0000000000000001e-15,"soa2_a2":1.0000000000000001e-15,"soa3_a1":1.0000000000000001e-15,"soa3_a2":1.0000000000000001e-15,"soa4_a1":1.0000000000000001e-15,"soa4_a2":1.0000000000000001e-15,"soa5_a1":1.0000000000000001e-15,"soa5_a2":1.0000000000000001e-15,"M":42.393400541636808}}]},"work":{"rhs_evaluations":{"available":true,"value":0},"jacobian_evaluations":{"available":true,"value":0}},"status":"success","diagnostics":[]}
