{"schema_version":1,"campaign_id":"chapman-smoke","run_id":"micm-chapman-0","block":0,"order_position":0,"solver":{"id":"micm","version":"3.13.0","revision":"97ac9e5d8aadd345c242722ee8274d71dfe0f73e","backend":"cpu","method":"three-stage-rosenbrock"},"manifest":{"id":"chapman","version":"1.0.0","sha256":"0000000000000000000000000000000000000000000000000000000000000000"},"scenario":{"id":"chapman-measurement-v1","version":"1.0.0","sha256":"0000000000000000000000000000000000000000000000000000000000000000"},"configuration":{"id":"micm-ros3-default","sha256":"0000000000000000000000000000000000000000000000000000000000000000","frozen":true,"controls":{"dt_seconds":60,"temperature_k":270,"pressure_pa":80000,"J1":9.9999999999999998e-13,"J3":0.0001}},"build":{"binary_sha256":"0000000000000000000000000000000000000000000000000000000000000000","asset_sha256":["0000000000000000000000000000000000000000000000000000000000000000"],"compiler":"c++20","flags":[],"precision":"binary64"},"resources":{"hardware_id":"local","physical_cores":1,"threads":1,"affinity":"unspecified","numa_policy":"unspecified"},"timing":{"boundary":"steady_state_solve","elapsed_ms":1.4449730000000001,"cell_steps":30,"clock":"std::chrono::steady_clock","synchronized":true,"synchronization":"synchronous MICM CPU Solve plus atomic fence","lifecycle_ms":{}},"state":{"checkpoints":[{"time_seconds":600,"values":{"O":1209.591364349028,"O2":5.1000000483430103e+18,"O3":808610250266.41711,"M":2.46e+19}}]},"work":{"rhs_calls":{"available":true,"value":3543},"jacobian_builds":{"available":true,"value":1767},"internal_steps":{"available":true,"value":1776},"accepted_steps":{"available":true,"value":1767},"rejected_steps":{"available":true,"value":0},"factorizations":{"available":true,"value":1776},"linear_solves":{"available":true,"value":5328}},"status":"success","diagnostics":[]}
