{"schema_version":1,"campaign_id":"standalone","run_id":"chapman-mkpp","block":0,"order_position":0,"solver":{"id":"mkpp","version":"0.1.0","revision":"workspace","backend":"Kokkos::DefaultExecutionSpace","method":"ros3"},"manifest":{"id":"ts1","version":"1.0.0","sha256":"0000000000000000000000000000000000000000000000000000000000000000"},"scenario":{"id":"chapman-measurement-v1","version":"1.0.0","sha256":"0000000000000000000000000000000000000000000000000000000000000000"},"configuration":{"id":"mkpp-ros3","sha256":"0000000000000000000000000000000000000000000000000000000000000000","frozen":true,"controls":{"dt":60}},"build":{"binary_sha256":"unavailable-at-runtime","asset_sha256":[],"compiler":"gcc","flags":[],"precision":"float64"},"resources":{"hardware_id":"runtime-host","physical_cores":1,"threads":1,"affinity":"external-policy","numa_policy":"external-policy"},"timing":{"boundary":"steady_state_solve","elapsed_ms":14574.920384999999,"cell_steps":2,"clock":"std::chrono::steady_clock","synchronized":true,"synchronization":"Kokkos::fence","lifecycle_ms":{}},"state":{"checkpoints":[{"time_seconds":600,"values":{"ALKNIT":1.0285177496628292e-261,"BZOOH":1.0772976299102588e-307,"C6H5OOH":4.0036957252989818e-10,"COF2":1.01883628952401e-10,"O2":0.18161578909775308,"COFCL":8.6882089745780514e-31,"HF":8.0331839780568078e-08,"F":8.2386115044872275e-15,"BENZO2":2.5553381181368013e-307,"BZOO":1.4624480789187694e-307,"N2":33.100772051932687,"E90":9.9992260299530428e-16,"NH_5":9.9861496005440139e-16,"NH_50":9.9986140960452922e-16,"ST80_25":9.9972223858284431e-16,"PAN":1.6603752182364267e-15,"MVK":0,"MACROOH":0,"SOAG0":1.8801530778704798e-09,"SOAG1":7.8367394590620556e-10,"SOAG2":2.3626995095780504e-09,"SOAG3":5.9966394476933993e-09,"SOAG4":2.4492471382688003e-08,"soa4_a1":1.0000000000000001e-15,"soa5_a1":1.0000000000000001e-15,"soa5_a2":1.0000000000000001e-15,"soa3_a1":1.0000000000000001e-15,"soa2_a1":1.0000000000000001e-15,"soa1_a1":1.0000000000000001e-15,"soa1_a2":1.0000000000000001e-15,"soa2_a2":1.0000000000000001e-15,"soa3_a2":1.0000000000000001e-15,"soa4_a2":1.0000000000000001e-15,"ISOPNITB":0,"SO3":7.0894459705047014e-21,"OCS":4.5940401373229684e-260,"SO":2.0718665624848568e-54,"S":1.8563385545136411e-81,"BCARYO2VBS":0,"SF6":1.0000000000000001e-15,"sink":1.006149999999997e-30,"H":2.2238786674609818e-06,"MEK":6.2561804730433411e-261,"MTERP":0,"N2O5":1.03181564754325e-06,"HCN":8.5027617821810778e-99,"SVOC":0,"ISOPNO3":0,"RO2":5.168684523728501e-261,"PHENO2":1.1346367659164238e-307,"BENZO2VBS":0,"IVOC":0,"TERPNIT":0,"ISOPO2VBS":0,"IVOCO2VBS":0,"HNO3":1.2911380316915556e-05,"ACBZO2":3.4376996519607619e-17,"CH3COOOH":8.3949542626767412e-15,"SO2":5.1450779702036486e-29,"MTERPO2VBS":0,"CH4":0,"CH3CL":9.1733000472625544e-313,"CH3CO3":2.0093091159015659e-15,"C6H5O2":5.4651941747047868e-10,"TERPROD1":0,"HYAC":3.9018511415434496e-271,"HPALD":0,"TOLUO2VBS":0,"H2O":0.1261997507852341,"NO2":1.9814222976575099e-07,"EOOH":2.8589174686779046e-08,"NTERPOOH":-4.9406564584124654e-324,"XYLEO2VBS":0,"CCL4":4.3528605577909465e-41,"CF2CLBR":1.5427069829167292e-22,"CF3BR":4.0335954130214764e-16,"CFC11":4.5070605172533493e-34,"CFC113":8.5029332153087163e-35,"CFC114":3.2027772627230362e-24,"CFC115":7.0256738297282634e-16,"CFC12":3.8193000626378073e-23,"CH2BR2":0,"CH3BR":1.1398379894740615e-294,"CH3CCL3":1.5530754732116386e-94,"NO":4.4147910382213334e-07,"BR":3.196877409395039e-10,"BRCL":9.6006307656337967e-11,"BRO":2.7411677458109277e-10,"BRONO2":3.0580653202818243e-14,"CL":4.0791508718120026e-10,"CL2":9.5922898237062114e-11,"CL2O2":2.4227576768681092e-13,"CLO":4.8525242672144378e-09,"CLONO2":5.2012809025259914e-11,"HCOOH":3.8348961935549597e-16,"HBR":3.0623073557446724e-11,"HOBR":5.831682017295116e-11,"HOCL":2.354473782555538e-08,"N":2.718573942157618e-18,"BIGENE":0,"C2H4":0,"C2H5O2":8.6311487805937653e-269,"CH3COCHO":2.4677875994792864e-16,"CH3COCH3":2.9427408311778059e-260,"O":0.00014256354402859863,"OCLO":7.0234214044235773e-11,"O1D":4.6587719419352141e-10,"PHENO":1.1865337065210672e-12,"HCFC141B":7.0877207081403178e-80,"HCFC142B":1.9390446800973299e-53,"HCFC22":6.842138392297369e-59,"DMS":0,"C2H5OH":3.118172882867758e-280,"HCL":8.9681750312110679e-08,"BEPOMUC":1.7506243767973892e-10,"CHBR3":0,"H2402":3.3835044279035245e-26,"CO2":0.015613593643679594,"BZALD":8.2798765211828251e-310,"BENZENE":0,"C3H7O2":4.0389356425425069e-261,"CH3O2":1.552939364902247e-14,"BCARY":0,"BIGALD":3.8646980220386122e-12,"BIGALD2":3.2981512695239213e-10,"BIGALD3":3.0363495083505402e-10,"BIGALD4":1.0588900354846882e-09,"BIGALK":0,"H2O2":0.00024868727292884683,"C2H5OOH":6.352539053715949e-269,"C2H6":0,"C3H8":0,"C3H6":0,"CH2O":3.6813428364225026e-15,"CH3CN":5.5634276755992157e-213,"C2H2":0,"CH3OH":1.090374116374732e-24,"CH3OOH":7.400762191267449e-15,"CRESOL":0,"ENEO2":4.9406564584124654e-324,"MACRO2":0,"ISOPAO2":0,"MALO2":1.6413276661589659e-15,"ISOPBO2":0,"MCO3":0,"MDIALO2":1.069547701847137e-15,"MEKO2":7.099076312512287e-261,"EO2":0,"EO":2.0527269723778545e-18,"GLYOXAL":3.2220254496650218e-16,"MPAN":0,"NC4CH2OH":0,"ISOPOOH":0,"GLYALD":6.6444604365310507e-18,"HO2":3.6574411286848145e-05,"HOCH2OO":2.7228982574152647e-17,"H2":0.61960275215514071,"HYDRALD":0,"ISOP":0,"NTERPO2":-4.9406564584124654e-324,"TOLO2":8.8870238433044874e-307,"TERP2O2":-1.4821969375237396e-323,"XYLENO2":4.7094959187258176e-307,"TERPO2":1.4821969375237396e-323,"XYLOLO2":4.6227022373347767e-308,"PBZNIT":1.7131334029845994e-10,"XYLENES":0,"PO2":0,"TOLUENE":0,"XO2":0,"XOOH":0,"TERPROD2":0,"MEKOOH":4.1799665330007621e-261,"MACR":0,"HONITR":0,"ISOPNITA":0,"ISOPNOOH":0,"IEPOX":0,"ONITR":9.2749880629039355e-09,"H2SO4":8.1296700017505842e-08,"N2O":5.421415835818472e-17,"NO3":6.9935351231161062e-08,"OH":5.6108105483639292e-05,"PHENOOH":8.358187318585132e-308,"PHENOL":0,"XYLOL":0,"ROOH":3.7078092709629368e-261,"O3":0.0067207272283253032,"TERPOOH":0,"TOLOOH":6.5465364968212775e-307,"XYLENOOH":3.4692026776542871e-307,"XYLOLOOH":3.4052669874909238e-308,"CO":6.1520441914770735e-05,"CH3COOH":4.0715192114216099e-15,"CH3CHO":8.725596159968911e-262,"BIGALD1":6.6423986321184809e-10,"ALKOOH":1.351379501682943e-259,"DICARBO2":1.161766819321079e-15,"BENZOOH":1.8823640565232148e-307,"ALKO2":1.8361014171026312e-259,"HO2NO2":4.9003114167134505e-08,"C3H7OOH":2.972751022600947e-261,"NH3":0,"TERP2OOH":-4.9406564584124654e-324,"POOH":0,"NOA":0,"NC4CHO":0,"TEPOMUC":7.29474617887019e-10,"NH4":9.9996196072350301e-16,"M":42.393400541636808}}]},"work":{"internal_steps":{"available":false,"reason":"generated MKPP kernel does not expose this counter"}},"status":"success","diagnostics":[]}
